Dept ID,Department,Network,Total Staff,Teaching Staff,Total Staff Budget,Teaching Staff Budget,Students,Teacher Spending Per Student
49021,Northside Learning Center,Network 14,98,33,5089471,2392334,275,8699.34
11675,Diverse Lrn Related Svc Prv CW,,1534,0,100502092,0,0,0.0
23231,Telpochcalli,Network 7,42,23,2570855,1758927,211,8336.14
23131,Esmond School,Network 10,36,17,2225225,1336180,235,5685.89
25351,Jesse Sherwood School,ISP,39,24,2490010,1750181,201,8707.36
25711,James Wadsworth School,Network 9,63,35,3453047,2249556,461,4879.72
23911,Edward N Hurley School,Network 10,74,51,4460665,3571569,732,4879.19
47061,Senn Metropolitan Academy Of Liberal Arts & Technology,Network 14,152,94,9422422,6556858,1597,4105.78
31281,Orozco Academy,Network 7,61,38,3302309,2306125,275,8385.86
46181,Thomas Kelly High School,Network 16,189,115,13100527,9258207,1637,5655.62
47101,Whitney M Young Magnet High School,Network 15,175,111,12072194,8793929,2230,3943.51
24771,Oriole Park School,Network 1,68,48,4177635,3323736,603,5511.97
22941,William E Dever School,Network 1,73,55,4264908,3578630,705,5076.08
29311,John H Vanderpoel Magnet Sch,Network 10,34,18,2054512,1250420,245,5103.74
24761,William J Onahan School,Network 1,57,39,3748076,2925670,645,4535.93
46321,Lincoln Park High School,Network 14,173,116,11570904,8559510,2210,3873.09
22531,Daniel R Cameron Elementary School,Network 5,78,49,4848892,3568548,640,5575.88
29011,Thomas A Edison Reg Gifted Ct,Network 1,22,13,1470968,939340,266,3531.36
24721,West Park Academy,Network 5,55,36,3565145,2804738,404,6942.41
29221,Philip Murray Language Academy,Network 9,50,25,3093963,1788972,472,3790.2
22351,William H Brown Elementary School,Network 6,46,23,2588778,1528927,233,6561.91
25601,James N Thorp School,Network 12,45,24,2373182,1510065,303,4983.72
24021,Joyce Kilmer School,Network 2,90,60,5335760,4087735,784,5213.96
26601,William E B Dubois School,Network 13,31,17,1975141,1266171,180,7034.28
46291,Charles P Steinmetz Academic C,Network 14,134,79,8753011,6426589,1149,5593.19
22681,Eliza Chappell Elementary School,Network 2,70,43,3722785,2550855,586,4352.99
25151,Cesar E Chavez Multiclt Acad C,ISP,101,59,5765332,4123036,792,5205.84
46281,Carl Schurz High School,Network 14,180,117,11595261,8714139,1169,7454.33
22061,Philip D Armour School,ISP,42,21,2044738,1261850,241,5235.88
25211,Sauganash School,Network 1,50,33,3245327,2620235,671,3904.99
22881,Charles R Darwin School,Network 4,56,36,2906770,2044433,501,4080.68
22081,George Armstrong Elementary School,ISP,119,86,7678968,6385195,1261,5063.63
24081,Rudyard Kipling School,ISP,32,18,2105402,1448592,216,6706.46
23651,Robert Healy School,Network 6,111,77,7578996,5998785,1177,5096.65
22401,Luther Burbank School,Network 3,90,50,5870042,4175705,682,6122.73
47021,William Jones Academic Mag HS,Network 15,160,110,10658697,8154069,1970,4139.04
22231,Alexander Graham Bell School,Network 4,94,58,6422939,4673757,888,5263.23
26391,George Leland School,Network 3,53,30,2983014,1987712,321,6192.26
24401,Oscar F Mayer School,Network 4,78,44,4353232,3069221,705,4353.54
49051,Simpson Academy for Yng Women,,18,13,1378007,1088011,0,0.0
31181,Francis W Parker Comm Academy,Network 11,59,28,3380024,2115480,344,6149.65
23341,J W Von Goethe School,Network 4,76,48,4293713,3333701,710,4695.33
25771,George Washington School,Network 13,74,47,4723357,3654376,562,6502.44
23491,Nathan Hale School,Network 10,83,54,5505227,4294979,756,5681.18
24241,Joseph Lovett School,Network 3,37,25,2279636,1757559,326,5391.3
24461,Hanson Park School,Network 3,173,100,10789423,7889436,1049,7520.86
23201,Fernwood School,Network 13,30,14,1529335,776123,243,3193.9
30141,Courtenay Language Arts Center,Network 2,74,35,3637259,2133910,275,7759.66
24431,Cyrus H Mccormick School,Network 7,68,44,4059561,3198721,438,7303.03
22171,Newton Bateman School,Network 1,91,59,5618177,4241850,873,4858.97
25581,Mancel Talcott School,Network 6,64,39,3465571,2541361,522,4868.51
53061,Neal F Simeon Voc High School,Network 17,134,72,8015202,5113070,1143,4473.39
25631,Enrico Tonti School,Network 8,90,61,5997402,4754094,766,6206.39
70020,Walter Payton College Preperatory HS,Network 15,112,86,7475307,6072425,1257,4830.88
23321,Frank L Gillespie School,Network 12,58,36,3149576,2404488,310,7756.42
29071,Gerald Delgado Kanoon Magnet School,Network 7,57,36,3595644,2717467,344,7899.58
25471,Adlai E Stevenson School,Network 10,117,72,7729278,5735735,1131,5071.36
25101,Frank W Reilly School,Network 4,87,57,5494573,4284203,520,8238.81
25951,Richard J Daley Academy,Network 8,61,39,3505566,2686052,475,5654.85
24821,John M Palmer School,ISP,75,52,5199685,4227725,738,5728.62
41111,Marine Leadership Acad at Ames,Network 14,86,53,5809355,3851723,571,6745.62
31211,Pulaski International School of Chicago,Network 6,77,48,4783075,3473104,912,3808.2
24711,Norwood Park School,Network 1,44,28,2537439,1932244,287,6732.56
24201,Carl Von Linne School,Network 4,59,42,3949135,3195271,695,4597.54
23041,John F Eberhart School,Network 10,116,73,7408009,5563486,949,5862.45
22201,Jean Baptiste Beaubien School,Network 1,81,51,5683611,4048918,985,4110.58
24941,Mary G Peterson School,Network 1,84,58,5065787,4023975,864,4657.36
46331,George Washington High School,Network 17,144,87,8421414,5798130,1517,3822.1
23751,South Loop School,ISP,62,40,3812318,2670879,797,3351.18
22311,Brentano Math & Science Academy,Network 4,57,37,3320768,2477185,785,3155.64
23811,Rufus M Hitch School,Network 1,51,36,3289596,2627696,490,5362.63
46141,Gage Park High School,Network 16,65,34,3132573,1766202,358,4933.54
46421,Benito Juarez High School,Network 15,164,114,10535484,8169389,1656,4933.2
23621,Stephen K Hayt School,Network 2,89,63,5800917,4667851,789,5916.16
25931,Ludwig Von Beethoven School,Network 9,39,21,1902366,1085510,303,3582.54
25661,Mark Twain School,Network 10,93,60,6008886,4845789,821,5902.31
47031,Emil G Hirsch Metropolitan High School,Network 17,29,12,1676170,974964,118,8262.4
25071,William H Ray School,Network 9,73,45,4373436,3316322,620,5348.91
45211,Chicago Academy School,Network 1,59,37,3334179,2407745,541,4450.51
32011,Albany Park Multi Acad School,Network 1,31,19,1957351,1354558,241,5620.57
26651,Mahalia Jackson School,Network 11,49,24,2731236,1751872,289,6061.8
25031,Ernst Prussing,Network 1,63,46,4289170,3524081,641,5497.79
24281,Mary Lyon School,Network 3,115,81,7780151,6240133,946,6596.33
25021,William H Prescott School,Network 4,49,29,3019026,2215304,477,4644.22
53091,David G Farragut Career Academy High School,Network 16,103,48,5834071,3062007,479,6392.51
23901,Charles Evans Hughes School,Network 7,32,19,1482913,1016552,173,5876.03
23401,William P Gray School,Network 1,100,70,6930860,5652694,970,5827.52
46511,Lindblom Math and Science Academy High School,Network 16,131,87,8005479,5898757,1307,4513.19
29161,Lasalle Language Academy School,Network 4,59,41,3773488,2910144,464,6271.88
26721,Sandoval School,Network 8,90,55,5333340,3914188,697,5615.71
25231,Sidney Sawyer School,Network 8,135,88,8650538,6649652,865,7687.51
23421,Ariel Community Academy,Network 9,60,32,3223405,2179074,315,6917.68
46381,Carver Military High School,Network 17,55,24,3691867,2033156,450,4518.14
24841,Park Manor Elementary School,Network 12,30,15,1853817,1274213,261,4882.06
24981,Ambrose Plamondon School,ISP,22,13,1212136,835123,93,8979.81
25881,Wildwood IB World Magnet,Network 1,49,32,3044171,2334711,526,4438.61
46021,Hancock High School,Network 15,84,63,6002874,4923913,1050,4689.48
24611,Wolfgang A Mozart School,Network 4,61,39,3957021,3077751,471,6534.53
23591,Helge A Haugan School,ISP,102,67,6103650,4756784,1030,4618.23
25491,Edward F Dunne School,Network 13,29,17,1922429,1475132,185,7973.69
22831,Peter Cooper Dual Language Academy,Network 7,56,34,3279678,2387181,420,5683.75
53041,Charles Allen Prosser Career Academy,Network 15,136,71,8734406,5209117,1224,4255.83
24591,Mount Greenwood Elementary School,ISP,81,58,5465038,4405324,1172,3758.76
25241,Jonathan Y Scammon School,Network 1,68,50,4141363,3390698,597,5679.55
46361,Kenwood Academy,Network 17,146,92,10019519,7183441,2223,3231.41
26281,Henry O Tanner School,Network 12,44,24,2649413,1858979,239,7778.15
22091,Audubon School,Network 4,55,36,3270178,2535147,489,5184.35
29041,Turner-Drew Language Academy,Network 11,33,13,2050525,1008837,176,5732.03
25921,Ella Flagg Young School,Network 3,70,45,4991514,3862357,402,9607.87
22751,Dewitt Clinton School,ISP,103,77,6265811,5097500,1029,4953.83
23461,Robert L Grimes School,Network 10,48,31,2972490,2234281,357,6258.5
25381,John D Shoop School,Network 13,42,27,2594214,1888407,433,4361.22
29141,Galileo Scholastic Academy Of Math & Science,Network 6,57,33,3955924,2701633,552,4894.25
24531,James Monroe School,Network 4,77,54,5186825,4185805,606,6907.25
46241,Stephen T Mather High School,Network 14,139,98,10094138,7969457,1713,4652.4
26331,Richard Henry Lee School,ISP,73,47,4920953,3816423,570,6695.51
24231,Josephine C Locke School,Network 3,121,76,7637932,5703281,1028,5547.92
23991,Joshua D Kershaw School,Network 11,36,20,2147140,1361276,204,6672.91
46301,Roger C Sullivan High School,Network 14,92,54,5418315,3558207,790,4504.06
24681,William P Nixon School,Network 4,80,55,5143457,4017188,665,6040.88
25431,Hannah G Solomon School,Network 1,47,24,2909884,2034084,307,6625.68
29201,Mark Sheridan Mathematics & Science Academy,Network 6,53,29,3361020,2289559,517,4428.54
22241,Frank I Bennett School,Network 13,30,17,2112559,1462556,289,5060.73
51071,Wells Community Academy HS,Network 15,54,28,3181118,2033508,419,4853.26
46221,Albert G Lane Tech High School,Network 14,321,244,22425315,18563400,4650,3992.24
22501,Michael M Byrne School,Network 10,62,41,4179383,3099971,551,5626.07
22971,Arthur Dixon School,Network 12,48,29,2906210,2019522,390,5178.25
22541,Arthur E Canty,Network 1,72,50,4717382,3952616,790,5003.31
24661,Louis Nettelhorst School,Network 4,75,50,4760287,3722419,645,5771.19
23541,William F Finkl School,Network 7,56,31,2701216,1776151,211,8417.74
46211,Lake View High School,Network 14,147,92,9567592,6886392,1474,4671.97
25371,Beulah Shoesmith School,Network 9,36,23,2117606,1566260,296,5291.42
25011,Portage Park School,Network 1,88,57,5497132,4150337,899,4616.65
22811,Jordan Community School,Network 2,62,38,3432071,2647160,470,5632.28
26021,Willa Cather School,Network 5,44,24,2788560,1986512,293,6779.89
24051,Lazaro Cardenas School,ISP,118,76,7408668,5569657,725,7682.29
23361,Virgil Grissom School,Network 13,39,23,2238319,1678507,266,6310.16
22181,Lillian R Nicholson Sch-Mth/Sc,Network 11,54,31,3375897,2498548,439,5691.45
24631,Ronald H Brown Community Academy,Network 13,35,20,2178936,1531176,267,5734.75
46401,Percy L Julian High School,Network 16,73,37,4155903,2592294,424,6113.9
24641,Henry H Nash School,Network 3,32,18,1757658,1248909,288,4336.48
46341,Gurdon S Hubbard High School,Network 16,164,90,11240510,7023027,1581,4442.13
23001,John C Dore School,Network 10,67,42,4239072,3280445,711,4613.89
22161,Perkins Bass School,Network 11,49,29,2880821,2104624,293,7183.05
23531,Charles G Hammond School,Network 7,52,37,2918095,2203993,236,9338.95
26591,Medgar Evers School,Network 11,32,17,2193765,1417337,194,7305.86
31251,Thomas J Higgins Comm Academy,Network 13,32,18,2085965,1468124,269,5457.71
25301,William H Seward Com Arts Acad,Network 8,68,41,4153735,2986647,362,8250.4
23931,Minnie Mars Jamieson School,Network 2,81,55,5181879,4037088,788,5123.2
46061,Northside College Prep,Network 14,97,63,6657712,5177334,1069,4843.13
25731,John A Walsh School,Network 7,49,27,2872277,2019785,299,6755.12
46031,Roald Amundsen High School,Network 14,142,69,9141685,5321076,1447,3677.3
41051,Michelle Clark Academic Prep Magnet High School,ISP,73,32,4132697,2037269,473,4307.12
46271,Theodore Roosevelt High School,Network 14,115,77,7603832,5723067,1085,5274.74
25141,Philip Rogers School,Network 2,73,50,4872486,3831614,791,4844.01
22521,Little Village Academy,ISP,80,51,4842274,3601375,547,6583.83
23051,Christian Ebinger School,Network 1,71,48,4429842,3654032,694,5265.16
23081,Richard Edwards School,Network 8,151,81,9215742,6350382,1124,5649.78
70070,Chicago Mil Acad - Bronzeville,Network 17,42,21,2459316,1334882,231,5778.72
51091,Roberto Clemente Community Academy High School,Network 15,102,54,4999634,2655130,766,3466.26
53101,Marie Sklodowska Curie Metro H,Network 15,283,145,19000023,11320385,2985,3792.43
24671,Florence Nightingale School,Network 8,115,73,7385916,5743158,876,6556.12
23031,Charles W Earle School,Network 11,47,26,2694789,1726800,272,6348.53
41061,Frederick A Douglass Mid Acad,Network 15,22,10,1368488,880509,30,29350.29
29261,Edgar Allan Poe Classical Scho,Network 13,21,10,1322620,654203,228,2869.3
22331,Orville T Bright Elementary School,Network 13,46,24,2237572,1343206,189,7106.9
29231,Walter L Newberry Mathematics & Science Academy,Network 4,70,38,4243378,2571788,311,8269.42
22321,Norman Bridge School,Network 1,87,66,5713479,4790502,1072,4468.74
25121,Paul Revere Accelerated School,Network 12,24,12,1302190,818275,199,4111.94
23681,James Hedges School Main,Network 8,65,41,3785070,2847756,468,6084.95
29321,Beasley Academic Center Magnet,Network 9,118,56,6468161,3992896,1136,3514.88
23821,Charles N Holden School,ISP,52,33,2685388,1786585,395,4523.01
26631,Oscar Depriest School,Network 3,72,41,4426926,3165848,439,7211.49
47091,Chicago HS for Agricultural Sc,ISP,90,41,5358043,2987539,776,3849.9
24441,Emmit Louis Till Math/Sci Acad,Network 9,39,22,2234137,1487167,345,4310.61
46131,Edwin G Foreman High School,Network 14,101,60,6528420,4673890,613,7624.6
23381,Robert J. Richardson Middle,Network 10,103,70,6887796,5442550,807,6744.19
24961,Josiah L Pickard School,Network 7,54,29,3265258,2066063,321,6436.33
22371,Bouchet Academy,Network 12,67,32,4197486,2620311,612,4281.54
46251,Morgan Park High School,Network 16,130,78,8680404,6120135,1202,5091.68
46371,King Selective Enrollment HS,Network 17,71,40,4356132,3192335,810,3941.16
24221,Henry D Lloyd School,Network 3,100,66,6312249,5020638,795,6315.28
29381,Robert A Black Magnet School,Network 12,42,24,2689911,1894859,368,5149.06
46171,Hyde Park Career Academy,Network 17,90,48,5770010,3587945,861,4167.14
29181,James E Mcdade Classical Sch,Network 12,21,10,1151892,564703,210,2689.06
30101,Ruben Salazar Bilng Ed Ctr Sch,ISP,42,25,2553902,1949164,355,5490.6
22041,Louisa May Alcott College Prep,Network 4,105,70,5966272,4454924,548,8129.43
46431,North Grand High School,Network 15,113,68,7101012,5010146,1021,4907.1
26781,Talman School,ISP,53,32,2893082,2107579,320,6586.17
23891,Countee Cullen School,Network 13,22,12,1515733,999883,156,6409.51
22871,Everett Mckinley Dirksen School,Network 1,71,50,5168473,4168619,1244,3350.98
23161,James B Farnsworth School,Network 1,71,42,4636209,3411653,479,7122.46
26031,R Nathaniel Dett School,Network 6,52,26,2542264,1498691,298,5029.18
22411,Edmund Burke School,Network 9,62,35,3364604,2302319,294,7831.0
31161,Lawndale Comm Academy,Network 5,33,17,1632258,1058898,194,5458.26
24741,Richard J Oglesby School,Network 11,52,32,3240260,2365423,265,8926.15
53011,Chicago Vocational Career Academy,Network 17,121,61,7583700,4689647,636,7373.77
23021,Thomas Drummond School,Network 6,38,19,2235592,1476790,324,4558.03
23561,Bret Harte School,Network 9,34,19,2187979,1438200,314,4580.25
24471,James B Mcpherson School,Network 2,101,52,5701848,3796798,760,4995.79
24891,Helen C Peirce School Of International Studies,ISP,98,65,6076909,4573275,1107,4131.22
25191,William H Ryder Math/Science Specialty School,Network 11,63,29,3689545,2304358,344,6698.7
29091,Matthew Gallistel Language Academy,Network 13,80,48,5664677,4090573,588,6956.75
23971,Kate S Kellogg School,Network 10,32,17,2052973,1381073,298,4634.49
24731,William B Ogden School,Network 15,212,134,12061068,8948266,836,10703.67
24251,James Russell Lowell Elementary School,Network 5,61,32,3334718,2246484,287,7827.48
30051,Daniel Carter Beard School,,71,22,3502250,1499284,0,0.0
23611,Emiliano Zapata Academy,Network 7,82,50,5103243,3900078,436,8945.12
23151,Laughlin Falconer School,Network 3,105,70,6835877,5341114,821,6505.69
22391,Lyman A Budlong School,ISP,78,51,4456059,3498002,748,4676.49
22851,Daniel J Corkery School,Network 7,62,36,3491176,2441195,430,5677.19
26831,Durkin Park School,Network 10,67,46,4137206,3333678,647,5152.53
47051,Gwendolyn Brooks High School,ISP,93,57,5975313,4226548,999,4230.77
26251,Irvin C Mollison School,Network 9,40,25,2350481,1782947,216,8254.37
24921,Harold Washington School,Network 12,34,22,2166972,1667199,239,6975.71
22141,John Barry Elementary School,Network 4,77,57,4431078,3504793,449,7805.73
22661,Horace Greeley School,Network 4,59,39,3801794,2920123,327,8930.05
22301,Alex Haley School,Network 13,58,31,3852437,2790387,424,6581.12
25291,Franz Peter Schubert School,Network 3,72,45,4322034,3267481,569,5742.5
11673,Diverse Lrn Service Delivery,,80,0,6135352,0,0,0.0
24911,William Penn School,Network 7,44,22,2540155,1601956,191,8387.21
26381,Oliver S Westcott School,Network 11,48,27,2529065,1791937,367,4882.62
22801,John W Cook School,Network 11,48,25,2602612,1870479,274,6826.57
22821,John C Coonley School,Network 2,98,60,5656630,4173238,730,5716.76
24991,Laura S Ward School,Network 5,55,31,3201495,2118499,266,7964.3
24361,John L Marsh School,Network 13,76,38,4724976,2850277,544,5239.48
49041,Consuella B. York Alt HS,,55,46,4639969,3959750,0,0.0
22551,Andrew Carnegie School,Network 9,54,32,3536453,2532844,364,6958.37
22771,Edward Coles Model For Exl Sch,Network 12,47,30,2637024,1973086,257,7677.4
46201,John F Kennedy High School,Network 16,164,111,10642895,8403783,1595,5268.88
22471,Jonathan Burr School,Network 6,45,31,2825084,2242514,461,4864.46
24851,Louis Pasteur School,Network 8,63,39,4290396,3251236,577,5634.72
29081,Franklin Fine Arts Center,Network 4,40,23,2505708,1645788,338,4869.21
25451,John Spry Community School,Network 16,59,38,3534730,2660873,295,9019.91
25521,Harriet Beecher Stowe School,Network 5,75,48,4045062,2960351,574,5157.41
29171,Andrew Jackson Language Acad,Network 6,53,24,3076855,1519202,456,3331.6
22211,Jacob Beidler School,Network 5,48,28,2691927,1852507,229,8089.53
25541,William K Sullivan Specialty School,Network 12,66,34,4153679,2783116,403,6905.97
23311,Joseph E Gary School,Network 7,109,70,5666053,4226613,700,6038.0
25591,Douglas Taylor School,Network 13,49,31,2793930,2104711,311,6767.58
26291,Adam Clayton Powell Jr Padaeia,Network 12,52,31,3323061,2424001,530,4573.58
31261,Jose De Diego Comm Academy,Network 5,84,42,4502057,2772901,561,4942.79
26451,Brighton Park School,Network 8,43,27,2713456,1918427,285,6731.31
23831,Oliver Wendell Holmes School,Network 8,26,16,1684571,1196088,143,8364.26
23371,William C Goudy School,Network 2,73,50,4718318,3764406,497,7574.24
29301,Ole A Thorp Scholastic Academy,ISP,78,36,5147593,2767085,830,3333.84
29021,Burnside Scholastic Academy,Network 12,51,20,3307826,1695976,274,6189.71
23711,Helen M Hefferan School,Network 5,40,19,2319974,1387672,205,6769.12
22601,Rachel Carson School,ISP,106,63,4913438,3468762,715,4851.39
22101,Avalon Park School,Network 12,30,18,1797677,1162029,196,5928.7
29281,Mark Skinner School,Network 6,93,51,5609044,3654520,1143,3197.32
24451,Francis M Mckay School,Network 10,86,49,5445302,3899492,595,6553.73
29271,Harriet E Sayre Language Acad,Network 3,53,33,3187945,2341064,380,6160.7
25401,Washington D Smyser School,Network 1,77,52,5265726,4153705,744,5582.91
46311,William Howard Taft High Schoo,Network 14,263,163,18799526,13156244,4320,3045.43
47081,Frederick W Von Steuben Metropolitan Science Center,Network 14,150,102,10162791,7825011,1703,4594.85
25831,John Whistler School,Network 13,40,22,2225525,1530777,229,6684.65
24191,Abraham Lincoln School,Network 4,70,51,4498568,3426170,840,4078.72
24871,Ferdinand W Peck School,ISP,107,59,5635593,3855516,731,5274.35
24801,Luke O'Toole School,Network 11,38,23,2175204,1514866,287,5278.28
24971,John T Pirie Fine Arts & Acad,Network 12,29,18,1987443,1494174,197,7584.67
24171,Arthur A Libby School,Network 8,45,22,2553849,1615515,269,6005.62
22571,Charles Carroll School,Network 10,52,31,3169643,2253097,397,5675.27
24381,Roswell B Mason Elementary School,Network 7,41,22,2425018,1678960,215,7809.16
25361,James Shields Elementary School,Network 8,79,46,4902788,3745043,428,8750.08
25791,Daniel Webster School,Network 5,34,17,1939938,1160041,196,5918.56
25411,John M Smyth School,Network 6,69,37,3624279,2414770,327,7384.63
24071,John H Kinzie School,ISP,83,43,5311705,3434900,628,5469.58
24931,Irma C Ruiz School,Network 7,72,47,4713869,3683353,424,8687.2
23871,Thomas Hoyne School,Network 12,26,16,1550067,1179695,219,5386.75
24301,James Madison School,Network 12,24,15,1825587,1353530,200,6767.66
30011,Nancy B Jefferson Alt School,,62,50,5625191,4792168,0,0.0
24691,Alfred Nobel School,ISP,74,48,3963874,2919075,551,5297.8
23291,Frederick Funston School,Network 4,61,35,3168985,2190809,424,5166.98
49081,Jacqueline B Vaughn Occ HS,Network 14,81,28,4242369,1995793,224,8909.79
25781,Thomas J Waters School,Network 2,52,39,3590768,2979502,682,4368.78
22271,Daniel Boone School,Network 2,85,56,5386776,4188210,722,5800.84
51021,Harlan Community Academy HS,Network 17,50,26,3110221,1888537,205,9212.39
29401,Walt Disney Magnet School,Network 2,131,70,8163113,4908571,1447,3392.27
23101,Edward (Duke) K Ellington Scho,Network 3,62,37,4037261,2939676,482,6098.9
29361,Ted Lenart Regional Gifted Cen,Network 11,26,16,1581593,1055522,301,3506.72
22421,Augustus H Burley Elementary School,Network 4,50,33,3175111,2489301,501,4968.65
22991,Jms R Doolittle Jr In/Up Cy Et,Network 9,37,20,1736513,1119323,243,4606.27
23301,John W Garvy School,Network 1,66,49,4519035,3720630,706,5270.03
25861,John Greenleaf Whittier School,Network 7,28,18,1873205,1338307,228,5869.77
22741,Grover Cleveland School,Network 1,69,46,4366928,3335546,489,6821.19
24951,Marcus Moziah Garvey School,Network 13,28,16,1595763,1022641,243,4208.39
26841,North River School,Network 1,38,24,2285969,1634114,302,5410.96
41091,Logandale Middle School,Network 4,73,45,4649850,3471533,437,7944.01
22861,Manuel Perez Jr School,Network 7,37,25,2399697,1809129,293,6174.51
22891,Nathan S Davis School & Annex,Network 8,84,49,4773790,3585705,524,6842.92
22281,Scott Joplin School,Network 11,42,27,2900846,2300234,263,8746.13
25681,Alessandro Volta School,Network 1,81,53,4989336,3941971,722,5459.76
53021,Dunbar Vocational Career Academy,Network 17,59,29,3290588,2029669,366,5545.54
22021,Jane Addams School,Network 13,64,43,3968632,3076344,516,5961.88
23261,Foster Park School,Network 11,43,23,2516076,1686113,337,5003.33
31221,Charles Sumner Mth/Sci Com Acd,Network 5,34,17,2106974,1442539,183,7882.72
29191,Inter-American Magnet,Network 4,73,47,4424098,3156203,626,5041.81
24331,Horace Mann School,Network 12,40,23,2212533,1469817,245,5999.25
24101,Rodolfo Lozano Bil & Intrnl Ct,Network 6,44,22,2287829,1450886,260,5580.33
22731,Henry Clay School,Network 13,58,40,3661196,2791865,559,4994.43
53051,Ellen H Richards Career Acad,Network 16,40,22,2284377,1435994,336,4273.8
25841,Eli Whitney School,Network 7,87,53,5348875,4057421,564,7194.02
30031,Walter S Christopher School,Network 8,107,37,5777669,2971698,303,9807.6
25561,Elizabeth H Sutherland School,Network 10,63,32,3863617,2310514,629,3673.31
22761,Henry R Clissold School,Network 10,68,29,3800326,2154306,446,4830.27
67021,Peace and Educ Coalition,,34,20,2059111,1280521,0,0.0
25181,Martha M Ruggles School,Network 12,40,22,2360451,1648620,266,6197.8
25091,William Claude Reavis School,Network 9,32,20,1851564,1346643,284,4741.71
23481,John C Haines School,Network 6,61,41,3992015,3157776,458,6894.7
25671,Lavizzo Elementray,Network 13,41,23,2445806,1786185,344,5192.39
29121,Frank W Gunsaulus Schol Acad,Network 8,69,44,3957471,2869335,664,4321.27
31111,John Hay Comm Academy School,Network 3,39,21,2040967,1282174,213,6019.6
23251,Joseph Kellman Corporate Community School,Network 5,34,20,2044177,1472821,183,8048.2
29241,William Bishop Owen Schol Acad,Network 10,30,12,1758125,803568,284,2829.46
46391,George Henry Corliss High School,Network 17,51,25,3356156,2040045,390,5230.9
22261,James G Blaine School,Network 4,88,56,5474746,4245834,628,6760.89
25331,Arnold Mireles Academy,Network 12,50,31,2916112,2229738,485,4597.41
22491,Milton Brunson Specialty Elementary School,Network 3,55,31,3212232,2288348,427,5359.11
29371,Albert R Sabin Magnet School,Network 6,58,38,3621032,2680212,357,7507.6
30081,Frederick Stock School,,45,22,2833503,1768366,0,0.0
24571,Donald L Morrill Mathematics & Science Specialty School,Network 10,64,41,3871550,3074018,524,5866.42
25441,Herbert Spencer Math & Science Academy,Network 3,66,32,3203798,2101503,388,5416.26
23431,Nathanael Greene School,Network 8,48,29,3052153,2241745,319,7027.41
22031,Louis J Agassiz School,Network 4,60,37,3468318,2420605,339,7140.44
22701,Salmon P Chase School,Network 4,69,35,3696430,2287817,426,5370.49
25871,A N Pritzker School,Network 6,61,41,3862985,2912849,681,4277.28
23961,Joseph Jungman School,ISP,53,30,2955801,2024628,295,6863.14
25041,George M Pullman School,Network 13,46,23,2520426,1652173,276,5986.14
49031,Southside Occupational Academy,,104,37,5238001,2570160,0,0.0
25941,Carrie Jacobs Bond School,Network 11,41,19,2349153,1460677,248,5889.83
29151,Maria Saucedo Scholastic Academy,Network 7,100,49,5781285,3418481,908,3764.83
49101,Ray Graham Training Center,,52,19,2871615,1472760,0,0.0
26421,Mary E Mcdowell School,ISP,22,10,1310296,716186,88,8138.47
31081,Stephen F Gale Comm Academy,Network 2,51,23,2275552,1284408,338,3800.04
22511,Caldwell Acad Of Math Sci/Tech,ISP,29,16,1842189,1279795,200,6398.99
20071,Columbia Explorers Academy,ISP,96,58,5117243,3705292,645,5744.64
26621,Charles H Wacker School,ISP,34,15,2115445,1263573,213,5932.28
25761,Joseph Warren Elementary School,Network 12,27,16,1354767,868991,251,3462.11
46041,William J Bogan Comp Tech HS,Network 16,95,44,5922501,3105353,632,4913.5
29341,Jensen Scholastic Academy School,Network 5,43,23,2650905,1753303,218,8042.68
